1084551|ALSJ||But, I think, the public perception is where our support's going to come from; and, harnessing that, and maintaining that at its proper edge and inspiring people to new careers and not having them come into a career field and dedicate themselves to an experiment and then have that experiment postponed and postponed and postponed and then it never flies. And the person feels like he's really been let down in life by the system. And that can be very damaging, and I think that's happened in many cases. That there's an over-anticipation. We keep crying that we need more and more engineers and, when people do studies, that doesn't necessarily seem to be the case. If we needed a whole lot more engineers, we'd be paying them a lot more money to get good engineers, it would seem to me. (Chuckling) While I'm on the subject, I'll take a moment or two more and talk about the term NASA scientist". The public perceives the word 'NASA scientist' as being the guy who builds rockets. Well, these are engineers; they're not scientists. And, because of that perception, we now have a space station that's being dedicated to science and it is really an engineering necessity. And it is not being judged by the Academy of Engineering as to its adequacy and its ability to fulfill what's needed. It's, again, being judged by the Academy of Sciences for its scientific content which really means 'Does it do the kind of experiments that these people want to see happen regardless of whether it fulfills the role of engineering long-term soundness'. Now, all of these things, I think, have to do with public perception and that, I think, is what your question was."
1084551|ALSJ||Readers interested in the question of how the decision was made as to who went out first should consult Andy Chaikin's excellent book "A Man on the Moon", together with Buzz's "Return to Earth". In the simplest terms, the decision hinged (if my readers will pardon the pun) on the design of the hatch, which swung into the cabin to the right, blocking Buzz's access to the exit until after Neil was out. Despite this engineering reality, Buzz expended some effort prior to the flight in trying to convince Deke Slayton, the former Mercury astronaut who was Director of Flight Crew Operations, and others that he, rather than Neil, be the one to go out first. His efforts were in vain.
1084551|ALSJ||It has been about five minutes since the last comm from the LM. At that time, Neil and Buzz had turned on their PLSS water pumps. On later missions, after setting the <a href="http://www.hq.nasa.gov/alsj/lm_press_reg_a_b.jpg" title="image" target="alsj">A & B Pressure Regulators</a> to Egress and verifying the CB panel configurations, the crews pressurized the suits and performed a pressure integrity check. In the following dialog, it seems likely that Neil and Buzz have been experiencing some comm problems. However, by 108:53:00, they are ready to close the <a href="http://www.hq.nasa.gov/alsj/lm_repress_valve.jpg" title="image" target="alsj">cabin repress valve</a> and to open the forward dump valve. Clearly, they have pressurized their suits. The Final EVA Configuration Cards will tell us if they planned to do a pressure integrity check
1085300|ALSJ||By closing this valve and opening a corresponding circuit breaker, they are keeping the ECS from repressurizing the cabin after they open the <a href="http://www.hq.nasa.gov/alsj/DumpValve.html" target="alsj">dump valve</a> in the <a href="http://www.hq.nasa.gov/alsj/forward_hatch.jpg" title="Frank O'Brien CAM photo" target="alsj">forward hatch</a>.
1085327|ALSJ||With two people in suits and backpacks, it wasn't going to be easy to lean down far enough to reach the <a href="http://www.hq.nasa.gov/alsj/forward_dump_valve.jpg" title="Frank O'Brien CAM photo" target="alsj">dump valve</a> built into the forward hatch. The photo shows the dump valve on LTA-1, displayed at the Cradle of Aviation Museum without a bacterial filter.
1085327|ALSJ|LMP|That's probably why Neil said what he did, and maybe I was too optimistic.
1085327|ALSJ||On some flights, the Commander opened the valve and on some flights it was the LMP. On Apollos 16 and 17, Duke and Cernan, respectively, reached up and back to open the overhead <a href="http://www.hq.nasa.gov/alsj/DumpValve.html" target="alsj">dump valve</a>. We talked a little about the difficulty Gene described in getting into position to work the overhead valve, and Neil said "I believe that. And my guess is that's probably true both pressurized and unpressurized. But pressurized would probably be worse." Buzz added, "It'd be barely possible." In order to open the dump valve in the hatch, one or the other of them will have to bend either his knees or his waist and get low enough to reach the valve. After some puzzlement over the dialog, we concluded that it was Buzz who opened the valve. Part of the problem was that the start of the next line of dialog was originally transcribed as "Okay, I want to go to Dump..." whereas I now believe that "Okay, we want..." is correct.
1085327|ALSJ||Journal Contributor Ken Glover notes that, at <a href="http://www.hq.nasa.gov/alsj/a11/a11.posteva.html#1141028" target="alsj">114:10:28</a> during the depressurization prior to the equipment jettison, Neil reported that they used the forward <a href="http://www.hq.nasa.gov/alsj/a11/../DumpValve.html" target="alsj">dump valve</a> down to 2 psi (pounds per square inch) and then opened the overhead valve as well, undoubtedly to speed things along. Because both Neil and Buzz are right-handed, it was probably Neil, standing on the left side of the cabin, who opened the overhead valve. See, also, the discussion after <a href="http://www.hq.nasa.gov/alsj/a11/a11.posteva.html#1134623" target="alsj">113:46:23</a>.
1085327|ALSJ||Once Buzz has the valve open, he will leave it open until the cabin pressure has dropped to 3.5 psi. At that point, Buzz will close the valve again so that he and Neil can watch their suits respond. The drop in cabin pressure increases the relative suit pressure to above 4.5 psi.
1085327|ALSJ||In listening to this line, all three of us concluded that it was Buzz who opened the valve.
1085327|ALSJ|CDR|I think so.
1085327|ALSJ|LMP|How could I have read the numbers, then? Come back up, again, and read them.
1085327|ALSJ|CDR|I guess you must have.
1085327|ALSJ||The latter is the pressure in the ECS which, for now, is isolated from both the cabin and the suits.
1085540|ALSJ||Buzz is wearing his watch on his suit sleeve and, apparently, starts his stopwatch function at 56 minutes after the hour, corresponding to the upcoming Ground Elapsed Time of 108:56.
1085540|ALSJ|LMP|I'm sure that Neil didn't wear his watch out on the surface. I'm sure he put it with the Velcro strap up in the AOT.
1085540|ALSJ|CDR|Someone, perhaps in correspondence, asked me about that. And I could not remember, although it seems quite logical, given the mission timer situation, that we would have left one watch inside.
1085540|ALSJ|LMP|I wasn't sure what the reason was, but I thought it was okay. It was your watch, if you wanted to leave it inside. I remember that specifically at that time, because I reflected back on it a little later when I shipped my watch to the Smithsonian and it turned up missing. That's when it refreshed in my mind, years ago, that you had left yours inside and mine was the only one out on the surface. It was one of those things...I had a watch on but I don't think I looked at it. Which would probably say that I should have had it set at something so that it was just not a normal time going around, but going from some specific...It was a lousy watch to have on the surface. It just didn't give good numbers as far as a stopwatch type thing. To have gone to all that expense and then to have crews out on the surface with just an ordinary watch, in retrospect, is a mistaken priority somewhere.
1085540|ALSJ||Jones - "The later crews had cuff checklists set up with timing relative to depressurization. They would start the stop-watch function at depress."
1085540|ALSJ|CDR|Seems logical.
1085540|ALSJ|LMP|Well, since we didn't have a checklist that was set up on (elapsed EVA) time, why we didn't get to cement in that kind of a procedure. But that's a very good one.
1085622|ALSJ||Sensors in the PLSSs have noted that, although the cabin pressure is low, the sublimators are not yet working. The <a href="http://www.hq.nasa.gov/alsj/plss/plss04.jpg" target="alsj">sublimator</a> consists of a sandwich of honeycomb plates on which, when exposed to vacuum, the feedwater turns to ice and it is the sublimation of the ice layer that provides cooling. The astronauts will not start the flow of feedwater until they get the hatch open and, by noting the warnings, they are making sure that the sensors are working.
1085622|ALSJ||Comm Break
1085622|ALSJ||For Apollo 11, the forward <a href="http://www.hq.nasa.gov/alsj/DumpValve.html" target="alsj">dump valve</a> is equipped with a bacterial filter which is having a considerable effect on the speed of decompression. The filters will not be flown on subsequent missions. With the filter in place, cabin pressure drops from 5.0 pounds per square inch, absolute (psia) to 0.08 psia in 310 seconds versus 180 seconds without the filter. Use of both the forward and overhead valves without filters would bring the time down to 90 seconds. For most of the Apollo EVAs, one or the other of the valves was used; although, for the equipment jettison they will do after the EVA, <a href="https://www.hq.nasa.gov/alsj/a11/a11.posteva.html#1141028" target="alsj">114:10:28</a> Neil and Buzz will use both valves. Because of the relatively large surface area of the hatch, it cannot be opened at cabin pressures much above 0.1 psia.
1085622|ALSJ|LMP|We didn't really want to go and open the overhead hatch (means the overhead dump valve). We like to open only one of them, and leave the other one the way it's been.
1085622|ALSJ||Comm Break
1085622|ALSJ||Buzz is on the right side of the cabin, leaning down to open the <a href="http://www.hq.nasa.gov/alsj/forward_hatch.jpg" title="Frank O'Brien CAM photo" target="alsj">hatch</a> which is hinged below his position. As it opens, it will swing inward and toward him, blocking off his position at about knee height. They have so little room that Buzz's helmet is scraping against Neil's chest-mounted Remote Control Unit.
1085622|ALSJ|LMP|He's wondering if I need some light, and I'm saying I was sure it was unlocked. It just wasn't coming open.
1085622|ALSJ|CDR|I recall that we thought we could pull it open against a little bit of pressure. And it turned out it took very little pressure to hold that thing closed to where we couldn't unseat it.
1085622|ALSJ||The lock lever is a very simple mechanism, with a short latching end and a longer handle pointed toward Buzz's side of the spacecraft. Thomas Schwagmeier has provided a <a href="http://www.hq.nasa.gov/alsj/hatch_handle.jpg" title="image" target="alsj">labeled photo detail</a>. The latching decal reads, Latch Operation: 1.Insert handle in end of shaft; 2. To lock - push on handle and rotate CW (clockwise) to stop; 3. To unlock - push on handle and rotate CCW (counter clockwise) to stop. In emergency - if latch is jammed in locked position - To open hatch pull lanyard to remove lock pin, rotate cam plate out of way of latch and open hatch.
1085622|ALSJ|LMP|I think it went all the way through and there was a lever on the outside, too.
1085622|ALSJ||On Apollo 12, Al Bean grabbed one of the corners of the hatch and peeled it back enough to let some oxygen out.
1085622|ALSJ||They could open the <a href="http://www.hq.nasa.gov/alsj/DumpValve.html" target="alsj">dump valve</a> in the overhead rendezvous hatch to speed depressurization. Neil and Buzz will use the overhead valve when they do the equipment jettison at <a href="https://www.hq.nasa.gov/alsj/a11/a11.posteva.html#1141028" target="alsj">114:10:28</a>. Otherwise, the only other time it was used was on Apollos 16 and 17. Because of his height, Cernan found it easier to reach up for the overhead valve than to reach down for the forward valve.
1085622|ALSJ|CDR|My recollection is - and it may be imperfect - that there was a filter just on the one valve (meaning the dump valve on the forward hatch). (True)
1085622|ALSJ|LMP|I don't think you'd want to put a filter on the top one, 'cause that's liable to come loose and get in the way with the docking and all that stuff.
1085622|ALSJ||As for Buzz's concern about tugging on the handle, pre-flight tests had indicated that the handle would break before the hatch would deform - at 180 pounds of force versus 240 pounds. At 0.25 psi of cabin pressure, opening the hatch took 78 pounds of force versus 118 pounds at 0.35 psi. Pre-flight tests indicated that it was all but impossible to exert more than about 100 pounds when opening the hatch in an inflated suit.
1085622|ALSJ|LMP|When the hatch was finally opened, it took an initial tug on it, and it appeared to bend. The whole hatch, as it opened on the far side, came toward me. As soon as it broke the seal, it appeared as though I could see some small particles rushing out.
1085622|ALSJ||Several of the crews noticed that ice crystals formed as the moist cabin air rushed out into the lunar vacuum. On one of the Apollo 17 hatch openings, the outflow even carried out a lost piece of bread.
1085622|ALSJ||With the valve in the Auto position, it can be opened from the outside in the event that the hatch closes and there is a pressure build up.
1085622|ALSJ||That is, the PLSS water flag. Evidently, they have turned on their PLSS feedwater diverter valves and, shortly, will begin to get cooling via the sublimator.
1085622|ALSJ|LMP|Once the water window did clear, it seemed that the cooling was noticeable almost immediately.
1085622|ALSJ||Mike is going to turn on a fan inside one of the CSM's tanks of liquid hydrogen in order to stir the contents and prevent radial stratification due to heat loss from the wall. It was a short circuit in a similar fan in one of the oxygen tanks that caused the Apollo 13 accident.
1085622|ALSJ||Evidently, Neil's feedwater flag has not yet cleared. On all of the missions it took several minutes for the sublimators to start working.
1085622|ALSJ||Frank O'Brien tells us that the ECS caution light comes on in any of four circumstances: (1) a glycol pump failure; (2) CO<sub>2</sub> partial pressure greater than 7.6 mm of mercury; (3) water separator failure; or (4) suit fan #1 failure. When the cabin is depressurized, the water separators shutdown, which is why the ECS caution light has illuminated.
1085622|ALSJ||Frank O'Brien writes "The Caution-and-Warning System could be very touchy. Since unintended alarms were known to occur, it was often easier to simply document circumstances when they occurred, rather than take the time and money to find engineering solutions. The ASC PRESS would normally come on if the pressure in the Ascent Helium tanks or in the propellant lines were below certain thresholds. Likewise, the PREAMP light would go on if the power supply for the RCS was out of tolerance. Clearly, illumination of these two lights were unintended in the context of EVA preparations but were unintended consequences of the Caution-and-Warning System design" During Apollo, NASA developed what is called Sneak Circuit Analysis ( <a href="http://www.hq.nasa.gov/alsj/SneakCircuitAnalysisHandbook.pdf" target="alsj">4 Mb PDF</a> ) to deal with such situations.
1085622|ALSJ||I asked about the problem of moving around in the cabin with both of them wearing pressurized suits. The accompanying <a href="http://www.hq.nasa.gov/alsj/LMSimulator.jpg" title="image" target="alsj">photo</a> by Stacey O'Brien shows her husband, Journal Contributor Frank O'Brien, standing next to a LM simulator on display at the Cradle of Aviation Museum.
1085622|ALSJ|CDR|My impression was that it was pretty tight. I think that, in our training inside both the LMS ( <a href=http://www.hq.nasa.gov/alsj/tnD7112Simulators.html" target="alsj">Lunar Module Simulator</a>) and also that other trainer we had (which Buzz called 'the EVA trainer'), we were usually dressed in street clothes and we had lots of room. And when we first did simulations with suits in there, we found out that the suits took up an awful lot of the space and things were much more cumbersome. It was much more difficult to operate in suits than we had come to expect in shirtsleeves. And, of course, when the suit is pressurized, it's that much worse. Suits filled up a lot of that LM cabin volume."
1085622|ALSJ|LMP|We put the anti-fog (wipe) on (the inside of the clear bubble helmet) as soon as we got the kit out, instead of waiting until a little bit later. I think that maybe there were two things that brought that about. One was that we weren't really sure it was going to appear later in the checklist, and we wanted to make sure we did that. The other was, in training, we wanted to avoid as many activities as we could with the PLSS on our back, because it was very uncomfortable doing any additional exercise in one g. We did find, however, that it was quite comfortable, even without the shoulder pads, to have the PLSS mounted on your back. The mass of it was not objectionable. It did require moving around methodically and very slowly to avoid banging into things - no getting around it. You just couldn't always tell what the back of the PLSS or the OPS might be in contact with at any particular time.
1085622|ALSJ|CDR|As was reported, we broke one circuit breaker with the PLSS and we depressed two others, one on each side, sometime during the operation with the PLSS on the back. So that's an area that we still need to improve on to be able to have confidence that the integrity of the LM itself won't be jeopardized by the operation with the PLSS on the back.
1085622|ALSJ||Journal Contributor Ulli Lotzmann notes that Buzz brought the broken circuit breaker back to Earth.
1085622|ALSJ||I asked if they did any <a href="http://www.hq.nasa.gov/alsj/a11/A11CrewTraining.html" target="alsj">training</a> for the egress with pressurized suits.
1085622|ALSJ|LMP|I think that, eventually, we did; but not very much.
1085622|ALSJ|CDR|This is one area of flight preparation that was never completely performed on the ground. In the (vacuum test) chamber, the PLSSs were left on the engine cover and we never put them on our backs because of their weight, and the possibility of jeopardizing the integrity of the LM. So the comm was operated, and the (hose) connections were made, but the depressurization sequence with the PLSSs on our backs was never completed. The times when we actually operated the PLSS was done always in the chamber and never done with the LM systems operable.
1085622|ALSJ||So two things were new to us. One was that it took a very long time to depressurize the LM through the bacteria filter with the PLSS adding gases to the cockpit environment and the water boiler (the sublimator) operation or something adding some cabin pressure. The second was that we weren't familiar with how long it would take to start a sublimator in this condition. It seemed to take a very long time to get through this sequence of getting the cabin pressure down to the point where we could open the hatch, getting the water turned on in the PLSS, getting the ice cake to form in the sublimator, and getting the water alarm flag to clear so that we could continue. It seemed like it took us about a half hour to get through this depressurization sequence.
1085622|ALSJ||If, as can be inferred from the air-to-ground, Neil and Buzz did wait until the hatch was open before they turned the feedwater diverter valve, then the only gases the PLSSs were adding to the cabin came from slight leakage of oxygen from the suits, which was expected. If so, Neil's speculation that the "water boiler" slowed depressurization is incorrect.
1085622|ALSJ||It has been almost 20 minutes since Buzz opened the <a href="http://www.hq.nasa.gov/alsj/DumpValve.html" target="alsj">dump valve</a> for the final depressurization. For the first Apollo 12 EVA, the same sequence of events took only 8 minutes, primarily because Pete and Al went after the hatch as soon as the cabin pressure was under 0.2 psi. In detail, Pete and Al had the hatch open 3 minutes after starting the final depressurization, where as Neil and Buzz took roughly 11 minutes.
1085622|ALSJ|CDR|(The Depressurization sequence) was one that we had never duplicated on the ground. Well, in retrospect, it all seemed to work okay, it was just that we weren't used to spending all that time standing around waiting.
1091555|ALSJ||During a <a href="http://www.hq.nasa.gov/alsj/a11/a11PostFlightPressConf.html" target="alsj">post-mission press conference</a>, Neil referred to the Lunar Equipment Conveyor (LEC) as a "Brooklyn clothesline". In a 2004 e-mail, he referred to it as the "Irish Washerwoman" and wrote, "The LEC idea came from the clotheslines on pulleys outside the windows of New York apartments." The LEC is a long nylon strap with a hook at each end so that it could be formed into a continuous loop. The strap ran around a pulley attached to a fitting in the cabin ceiling and out through the hatch to the Commander on the surface. Equipment could be attached to the hooks for transport between the cabin and the surface.
1091555|ALSJ||A 1939 <a href="http://www.hq.nasa.gov/alsj/a11/a11clothesline.jpg" title="image" target="alsj">photograph</a> by Sid Grossman - from the collection of the Museum of the City of New York - shows clotheslines in Harlem, NYC. Although such clotheslines were not unique to Brooklyn nor to New York, they were usually associated with poorer, immigrant neighborhoods and, because New York had a large immigrant population from the start of the great Irish migration of the 1840s onward, clotheslines strung between buildings was often thought of as a characteristic of the city.
1091555|ALSJ||A detailed discussion of the LEC with photographs is linked <a href="http://www.hq.nasa.gov/alsj/alsj-lec.html" target="alsj">here</a>.
1091555|ALSJ||Here, they are attaching the snap hook on Neil's neckring tiedown strap to the LEC. A complete discussion is linked <a href="http://www.hq.nasa.gov/alsj/a11/a11tether.html" target="alsj">here</a>.
1091612|ALSJ||According to <a href="http://www.hq.nasa.gov/alsj/a11/a11lsp40.jpg" title="document page" target="alsj">page 40</a> in the Final Apollo 11 Lunar Surface Procedures volume, Neil will "Move through hatch (with LEC tethered)" while Buzz will "Play out LEC and use as safety tether". Later (<a href="http://www.hq.nasa.gov/alsj/a11/a11lsp41.jpg" title="document page" target="alsj">page 41</a>), when Neil starts his period of Environmental Familiarization, he will "Detach and temporarily stow LEC on gear strut or ladder".
1091612|ALSJ||This may be a further LEC reference.
1091634|ALSJ||Neil is about to start the intricate process of getting down on his knees, with his back to Buzz, and then maneuver his feet toward the hatch and get himself in position to get out through the hatch.
1091634|ALSJ||The small area available to the crew at the front of the cabin is best illustrated by images taken during final Apollo 16 (LM 11, Orion) and Apollo 17 (LM 12, Challenger) LM close-out on the pad at the Cape prior to launch.
1091634|ALSJ||A <a href="http://www.hq.nasa.gov/alsj/a16/LM11-co42.jpg" title="image" target="alsj">view from above</a> shows the LMP's PLSS (without the OPS) and two helmet bags (containing the LEVAs) filling the space. As detailed on <a href="http://www.hq.nasa.gov/alsj/LM04_Lunar_Module_ppLV1-17.pdf" target="alsj">pages LV-4 and 5</a> in the Lunar Module News Reference, the useable floor area measures about 55 inches (140 cm) from side to side and about 36 inches (91 cm) from the hatch to the base of the 18-inch (46 cm) 'midstep' behind the crew stations. Note that the <a href="http://www.hq.nasa.gov/alsj/Apollo_PLSS_Dimensions.jpg" target="alsj">PLSS dimensions</a> are about 26 inches (66 cm) long, 19 inches (48 cm) wide, 9.5 (24 cm) inches thick at the base, and 8.75 (22 cm) inches thick at the top. The photographer was standing on the midstep, with its edge near the bottom of the frame.
1091634|ALSJ||An <a href="http://www.hq.nasa.gov/alsj/a16/LM11-co43.jpg" title="image" target="alsj">Apollo 16 frame</a> taken through the open hatch shows a member of the close-out team standing on tiptoes on the midstep, with the ECS on his right and stowed items behind the Commander's station on his left. A similar <a href="http://www.hq.nasa.gov/alsj/a17/LM12-co29.jpg" title="image" target="alsj">Apollo 17 frame</a> shows a member of the close-out team sitting on the Ascent Engine cover. Finally, an <a href="http://www.hq.nasa.gov/alsj/a16/LM11-co3.jpg" title="image" target="alsj">Apollo 16 frame</a> shows the top of the engine cover with Velcro strips and cloth straps where the LM crew secured the helmet bags after re-installing the drogue and probe in preparation for undocking from the CSM.
1091649|ALSJ|CMP|Eagle. The Flight Director during the EVA was Clifford E. Charlesworth.
1091649|ALSJ||The <a href="http://www.hq.nasa.gov/alsj/a12/A12Flown-Purse.html" target="alsj">purse</a> is a temporary stowage bag hanging at the front of the cabin below Panel 5 to the left of the hatch. In order to get out, Neil has turned to face the left rear of the cabin and, primarily with his hands, has lowered himself as he got his feet out through the hatch far enough that he could kneel on the cabin floor. After getting to his knees and getting centered in the hatch, he inches himself backwards, using Buzz's guidance to get his backpack under the DSKY (Display and Keyboard) panel over the hatch. He has to be careful to avoid bumping his head on the midstep and scratching his visor.
