-024044|AFJ||The transcript begins over two-and-a-half hours before launch. With the Apollo 11 spacecraft sitting atop its Saturn V launch vehicle on Pad 39A at the John F. Kennedy Space Center, announcements on the progress of the countdown are made by the Public Affairs Officer (PAO) Jack King, the 'Voice of Apollo'. The record of communications between the crew and the Mission Control Center, through 'CapCom' (the Capsule Communicator) commences soon after lift-off. This section of the journal will follow the flight through the launch and staging of the Saturn V launch vehicle, and insertion into Earth orbit about 12 minutes later. It concludes with the confirmation of orbital parameters and the safe check-out of the S-IVB third stage in orbit.
-023448|AFJ||Journal contributor Stephen Coester was a 28-year-old engineer who was working at a console (called C4HU) at the Launch Control Center. In a PDF file, <a href="pdf/stephen-coester-apollo11-lh2-leak.pdf">Launching Apollo 11 to the Moon</a>, he tells the story of this hydrogen leak.
-022352|AFJ||In fact, Fred Haise is the back-up Lunar Module Pilot. The other back-up crew members are Commander Jim Lovell and Command Module Pilot Bill Anders.
-022352|AFJ||When the crew arrived at the spacecraft they were already suited up and sealed off from Earth's natural atmosphere of nitrogen and oxygen. By the time they are ascending, they will have been breathing pure oxygen for about three hours and will have flushed dissolved nitrogen from their blood. This is to guard against the possible formation of nitrogen bubbles in their blood as the spacecraft air pressure drops to its nominal value of about a third of sea-level pressure, or in case of an unintended decompression of the spacecraft. Between the suiting-up room and the spacecraft, each crewman carried his own oxygen supply in a suitcase-sized unit.
-004600|AFJ||The lowest of the Saturn's main tanks was filled with 810,000 litres of RP-1 three weeks earlier. RP stands for 'rocket propellant' which in this case has been highly refined to minimise the fuel's sulphur content. The range of lengths of the molecule chains that make up the fuel was reduced to around 12 carbons to ensure more consistent and predictable combustion properties. The level in the tank was checked again at T-13 hours and again at T-1 hour.
-004600|AFJ||All three stages use liquid oxygen (LOX) as the oxidiser component in the burning process. It has been rendered liquid by being cooled to about -183&deg;C, just below its boiling point thereby allowing large quantities to be carried in huge tanks. At nine hours before launch, nitrogen gas is pumped through the tanks to purge out air and water vapour contaminants. Six and a half hours before launch, the tanks are precooled to prepare them for the loading of LOX. The S-IC requires 1.3 million litres, that for the S-II takes 331,000 litres and the S-IVB's LOX tank requires 77,000 litres.
-004600|AFJ||Filling these tanks with such cold liquids requires a little finesse. Initially, the LOX is fed at a slow rate which furiously boils as it contacts the relatively warm tank structure. The vapourisation of the LOX takes heat away until a pool of liquid begins to form at the bottom. When enough liquid has collected, filling steps up to a fast rate until the tanks are nearly full. The slow rate is then reestablished to top them off. From then on, until three minutes before launch, the level is replenished as the volatile LOX continues to boil off from heat leaking into the tank.
-004600|AFJ||The fuel for the S-II and S-IVB stages is liquid hydrogen (LH<sub>2</sub>). Like LOX, it must be cooled to render it liquid, this time to -253&deg;C which is only 20K above absolute zero. Conditioning the LH<sub>2</sub> tanks is more involved because all gases will freeze in the presence of liquid hydrogen except helium. Once clear of contaminants, the tanks are cooled to accept the propellants by first passing cold helium gas through the system then feeding propellant at a slow rate and allowing it to boil off, taking heat with it in a process similar to that for the LOX tanks. After filling at a fast rate, and to compensate for loss due to boil-off, both tanks are replenished until about three minutes before launch when the tanks are pressurised. Up to the launch, pressurising helium gas is supplied from the ground. After launch, the boil-off of the propellants is enough to maintain pressure. For the S-IVB, additional pressurising gas comes from a set of helium spheres mounted on the stage.
-004059|AFJ||Range safety is concerned with ensuring that if the rocket were to go wayward, it would do so without threatening injury or death to those on the ground. The Saturn's propellant tanks have shaped explosive charges attached. In the event the launch vehicle cannot be controlled, these would be detonated to open the tanks and ensure their contents are dispersed while at altitude. The charges for the fuel tanks are placed on the opposite side of the vehicle from those for the oxidiser tanks so as to minimise the degree to which the propellants would mix as they are dispersing.
-003555|AFJ||The next announcement comes from the PAO at Mission Control in Houston, rather than the Launch Control Center at Cape Kennedy, Florida.
-003059|AFJ||At the very top of the launch vehicle, between the S-IVB and the spacecraft, is a ring, only 1-metre-tall, called the IU (Instrument Unit). The ring's diameter matches the rocket stage below it. It carries systems primarily concerned with the guidance and control of the vehicle. These include a digital computer, an analogue flight computer and an gyroscopically stabilised platform mounted within three gimbals. This platform's ability to stabilise itself is such that without external influence it would stay in a constant orientation with respect to the stars even while Earth turns and it would therefore appear to slowly rotate, even though it is actually Earth that is rotating. This is an effect known as gyrocompassing. However, while the launch vehicle is sitting on the pad, the platform must not gyrocompass. Instead, its pitch or Y axis should be at right angles to the intended heading of the vehicle, a heading which depends on the precise time of launch.
-003059|AFJ||In Apollo 11's case, a 9:32 am launch requires that the Saturn's groundtrack away from the launch pad will be on a bearing of 72.058&deg;. Therefore, the platform is aligned so that the minus-Z axis lies along that heading (or azimuth) and a servo system holds it there, not allowing it to respond to Earth's rotation. This is achieved using a theodolite located 210 metres directly south of the vehicle which shines a beam of light through a window in the skin of the IU and another in the casing that surrounds the platform. The platform's orientation with respect to the theodolite will be maintained until just 17 seconds before launch. After that, it is released and will maintain its orientation with respect to the stars.
-003059|AFJ||When the Saturn V sits on the pad, its axes are aligned with the points of the compass. But in order to fly along the intended heading, it must carry out a roll manoeuvre as soon as it has cleared the tower. This will align the vehicle's coordinate system with that of the platform. From then on, simply by carrying out a pitch manoeuvre, the vehicle will begin its tilt towards the horizontal while flying along the desired heading.
-000031|AFJ||The phrase 'guidance is internal' refers to the moment at T minus 17 seconds that the Saturn V's guidance system is no longer held in an orientation with respect to Earth. It is now inertial and holds an orientation with respect to the stars. It has already been prealigned to a azimuth of 72.058&deg;, the rocket's intended heading. Soon after launch, the vehicle will roll around in order to match that orientation before commencing a preprogrammed pitch manoeuvre to send it heading for low Earth orbit. This moment is more formally called Guidance Reference Release or GRR. GRR begins a 16-second period that inhibits the first of the Saturn V's control timebases.
-000031|AFJ||The F-1 engine has a complex ignition sequence which will be described here. First, a description of the engine.
-000031|AFJ||A large combustion chamber and bell have an injector plate at the top, through which RP-1 fuel and LOX are injected at high pressure through 2,816 holes. Above the injector is the LOX dome which also transmits the force of the thrust from the engine to the rocket's structure. A single-shaft turbopump is mounted beside the combustion chamber. The turbine section of this turbopump is at the bottom and is driven by the exhaust gas from burning RP-1 and LOX in a fuel-rich mixture in a chamber called the gas generator. After they power the turbine, these gases pass through a heat exchanger, then to a wrap-around exhaust manifold which feeds them into the periphery of the engine bell. The final task for these hot gases is to cool and protect the nozzle extension from the far hotter exhaust of the main engine itself.
-000031|AFJ||Directly above the turbine, on the same shaft, is the fuel pump with two inlets from the fuel tank and two outlets that feed high pressure fuel, via shut-off valves, to the injector plate. A line from one of these feeds supplies the gas generator with fuel. Fuel is also used within the engine as a lubricant and as a hydraulic working fluid, though before launch, RJ-1 ramjet fuel is supplied from the ground, it being more suited for this purpose. At the top of the turbopump shaft is the LOX pump with a single, large inlet in-line with the turboshaft axis. This pump also has two outlet lines, with valves, to feed the injector plate. One line also supplies LOX to the gas generator.
-000031|AFJ||The interior lining of the combustion chamber and engine bell consists of a myriad of pipework through which a large portion of the fuel supply is fed. This cools the chamber and bell structure while also pre-warming the fuel. To ensure ignition, a cartridge of fluid sits in a branch of the high pressure fuel circuit. It has burst diaphragms at either end and its own inject points on the face of the injector plate. This fluid is triethylboron with 10-15 per cent triethylaluminium (known as TEA/TEB) and it is pyrophoric (i.e. self igniting) in the presence of liquid oxygen. Older documents refer to this substance as being hypergolic.
-000031|AFJ||At about T minus 8.9 seconds, a signal from the automatic sequencer initiates a number of automatic operations in the engine which includes the firing of four pyrotechnic devices. Two of them are mounted inside the nozzle extension and cause the fuel-rich turbine exhaust gas to ignite when it enters. Another two initiate combustion within the gas generator. Links are burned away by these igniters to generate an electrical signal to move the start solenoid. The start solenoid directs hydraulic pressure from the ground supply to open the main LOX valves. LOX begins to flow through the LOX pump, causing it to begin slowly rotating' The LOX then flows through the injector into the combustion chamber. The opening of both LOX valves also causes another valve to allow fuel and LOX into the gas generator, where they ignite and their exhaust gas cause the turbine to accelerate. Fuel and LOX pressures rise as the turbine gains speed. The fuel-rich exhaust from the gas generator ignites in the engine bell to prevent backfiring and burping of the engine. The increasing pressure in the fuel lines opens a valve, the igniter fuel valve, which lets fuel pressure reach the igniter cartridge which promptly ruptures. TEA/TEB fluid, followed by fuel, enters the chamber through its ports where it spontaneously ignites on contact with the LOX already in the chamber.
-000031|AFJ||Rising combustion-induced pressure on the injector plate actuates the ignition monitor valve, directing hydraulic fluid to open the main fuel valves. These are the valves in the fuel lines between the turbopump and the injector plate. The fuel flushes out ethylene glycol which had been preloaded into the cooling pipework around the combustion chamber and nozzle. The heavy load of ethylene glycol mixed with the first injection of fuel slows the build-up of thrust, giving a gentler start. Fluid pressure through calibrated orifices completes the opening of the fuel valves and fuel enters the combustion chamber where it burns in the already flaming gases. The exact time that the main fuel valves open is sequenced across the five engines to spread the rise in applied force that the structure of the rocket must withstand.
-000031|AFJ||This diagram shows how the thrust rose during the start-up of each engine. It takes two seconds for full performance to be attained on all engines once the first has begun to increase. The engines are started in a staggered 1-2-2 sequence so that the rocket's structure would be spared a single large load increase, with the centre engine being the first to start. The outboard engines exhibit a hiccup in their build-up due to the ingestion of helium from the pogo suppression system installed in each one. The centre engine does not have this installed.
-000031|AFJ||As the flow of fuel and LOX rises to maximum, the chamber pressure, and therefore thrust, is monitored to confirm that the required force has been achieved. With the turbopump at full speed, fuel pressure exceeds hydraulic pressure supplied from ground equipment. Check valves switch the engine's hydraulic supply to be fed from the rocket's fuel instead of from the ground.
-000031|AFJ||Public Affairs Officer Jack King, whose coolness is legendary, finally succumbs to the tension and is clearly heard to say "all engine running" instead of "all engines running".
0000000|AFJ||As the vehicle begins to rise, disconnection of an umbilical triggers the start of time base 1 in the Saturn V's control system. This sequence of events is concerned with the operation of the S-IC (except guidance) through most of its powered flight.
0000004|AFJ||As planned, control of the flight now passes from the Launch Control Center at Cape Kennedy, Florida to the Mission Control Center in Houston, Texas. There, communication with the crew is handled by an astronaut sitting at the CapCom console; in this case, Bruce McCandless. The PAO also switches, and Jack King relinquishes the commentary to the Houston PAO, whose voice is heard from now on.
0000015|AFJ||When it sat on the launch pad, the space vehicle's coordinate system matched the cardinal points of Earth's geograpic system. Its X-axis pointed straight up and its Y-axis pointed to true north. The third component of this system, the Z-axis, therefore was pointed directly west. Before it begins to tilt over, the vehicle needs to roll 18&deg; so that the minus X-axis, previously facing east, faces along the planned heading, in this case 72&deg; east of north. Then the tilt motion will be a simple pitch motion around the Y-axis.
0000015|AFJ||Prior to the roll maneuver, the vehicle executed a small yaw maneuver to deliberately lean away from the launch tower during its first few seconds of ascent.
0000015|AFJ||20.6 seconds after launch, time base 1 aims the four outboard engines slightly away from the centreline of the vehicle. This is in case an outboard engine fails whereupon the resultant off-centre thrust vector would be nearer to acting through the centre-of-mass of the rocket.
0000042|AFJ||Like the Space Shuttle that came after it, the flight of a Saturn V had defined times during which the means by which the crew could escape from a failing vehicle were defined. Unlike the Shuttle with its solid rocket boosters which gave no escape option during their operation, the Saturn had so-called 'abort modes' throughout its ascent, even during first stage boost. One of the advantages of liquid-propelled rockets is that they can be shut down. Solid motors will burn until they are done.
0000042|AFJ||For the first two abort modea, one-alpha and one-bravo, rotation rates exceeding &plusmn;4&deg; per second in pitch and yaw, &plusmn;20&deg; per second in roll will entail an abort.
0000042|AFJ||The first 42 seconds are flown in abort Mode One-Alpha. If things went wrong with the launch vehicle during this time, the Launch Escape Tower (LET) would lift the Command Module away from the booster. However, at this early stage, the CM needs to be taken away out to sea as the vehicle has not yet imparted much horizontal velocity. To achieve this in a One-Alpha abort, a small 'pitch control' motor would additionally fire to send the CM away from the vicinity of the impending conflagration. The CM then goes through an automatic sequence to carry out a safe landing on Earth.
0000042|AFJ||Mode One-Bravo is similar except the pitch control motor would not be required since the vehicle would have tilted over enough to aim an escaping CM out to sea. Instead, during a One-Bravo abort, a pair of canards at the tip of the LET would deploy to force the CM-tower combination to adopt a CM-first attitude. This was because hypersonic testing had shown that the CM-LET combination had a stable tower-first attitude. This mode extends to about 35.5 km altitude.
0000123|AFJ||As it flies through the air, the rocket must withstand an aerodynamic pressure imparted by its speed through the molecules of the atmosphere. This is like the pressure felt on a hand stuck out of the window of a fast-travelling car. In the rocketry situation, two things are happening to vary this pressure: the vehicle's rising speed makes it higher; the rapidly thinning atmosphere brings it down. The interaction of these two variables leads to a point in the ascent when the aerodynamic pressure, denoted by the letter 'Q', reaches a peak. This is known as Max-Q and is the point when weaknesses in the rocket's structure are most likely to be found out, especially if it has any slight sideways motion through the air. Max-Q occurs at 1 minute and 23 seconds into the flight.
0000159|AFJ||Mode One-Charlie begins at an altitude of about 30.5 km. At this altitude and beyond, the air is too thin for the LET canards to be effective so control of the CM's attitude during an abort would initially go to the its maneuvering thrusters. The acceptable range of vehicle rotation is altered and is now &plusmn;9&deg; per second in pitch and yaw, &plusmn;20&deg; per second in roll.
0000219|AFJ||135 seconds after the start of time base 1, its programming shuts down the central or inboard engine of the Saturn V in order to limit the vehicle's rapidly rising acceleration. There are two reasons for this rise. The first and dominant reason is that the mass of the vehicle as a whole is dropping by over 13 metric tons every second. As a result, the engines have a decreasing mass to push against. A lesser factor is the rising efficiency of the engines as they ascend out of sea-level air pressure into the near vacuum of the upper atmosphere. At sea level, the atmosphere acts somewhat as a cap on an engine's nozzle, getting in the way of the exiting gases. In a vacuum, the exhaust gases can exit without hindrance. The result on the F-1 is a 20 per cent rise in thrust. As the acceleration nears 4g, the shutdown of the inboard engine reduces it by one fifth.
0000219|AFJ||This graph is redrawn from the AS-506 Flight Evaluation Report. It shows how the acceleration experienced by the crew varies over the course of the Saturn's ascent. The key events in the graph are: <ol> <li>Lift-off under S-IC power. Note how the acceleration rises rapidly as the propellant tanks empty and the engines increase in efficiency.</li> <li>Cut-off of the central or inboard engine engine of the S-IC as acceleration nears 4g.</li> <li>Cut-off of the remaining four outboard engines of the S-IC at a peak of 4g.</li> <li>S-II stage ignition. Note the reduced angle of the graph. Although the mass of the first stage has been discarded, the thrust of the S-II stage is one ninth of the final S-IC thrust.</li> <li>Cut-off of the inboard engine of the S-II at a peak of approximately 1.8g.</li> <li>Change in mixture ratio caused by the operation of the PU valve. The richer mixture reduces the thrust slightly but also increases engine efficiency.</li> <li>Outboard engine cut-off of the S-II at approximately 1.7g.</li> <li>S-IVB stage ignition. Note again the reduced angle of the graph caused by the thrust being cut by a fifth.</li> <li>With the cut-off of the S-IVB's first burn, the vehicle is in orbit and the acceleration drops to zero.</li> </ol> The 4g experienced at the end of the S-IC burn is the highest that will be reached during ascent. The only time a greater g-force will be experienced during the mission is upon re-entry at the end when over 6g will be imparted on the crew.
0000219|AFJ||With the shutdown of the centre engine, the IU looks to see that the vehicle has gained sufficient velocity. If it has, then it begins time base 2 which will coordinate the end of the S-IC's flight, first by arming the separation pyrotechnics and by enabling the systems that detect the depletion of the S-IC tanks.
0000219|AFJ||The Saturn's guidance computer then performs 'tilt arrest'. Throughout the S-IC burn (and for the start of the S-II), the vehicle has been flying a series of pre-programmed maneuvers called the tilt sequence. The yaw at launch and the roll to align the rocket with the launch azimuth were two of these. The major maneuver of the tilt sequence has been a slow tilt around the pitch axis towards horizontal as the vehicle climbs. Note that this form of guidance is not trying to aim for a particular point. Though it is taking account of where it is and how any wind is affecting it, it is not attempting to correct for it and so it is described as open-loop guidance. At the end of the S-IC burn when staging takes place, it is no longer desirable to have the vehicle rotating, so the tilt maneuver is stopped or arrested.
0000219|AFJ||When level sensors detect that the S-IC tanks are about to empty, a signal is sent to shut down the four remaining F-1 engines. This signal also initiates time base 3 which will coordinate all the events surrounding staging and the flight of the S-II (apart from guidance).
0000244|AFJ||The S-IC first stage has shut down and separated from the S-II second stage.
0000244|AFJ||The sequence for separation is as follows: Half a second after shutdown of the first stage, four ullage motors mounted around the interstage are ignited. One fifth of a second later, a command is sent to fire the first separation explosive charge and to ignite eight retro rockets mounted in the conical fairings near the base of the S-IC. This results in two sets of rockets firing in opposite directions to pull the two sections of the vehicle apart once they are physically separated. 0.7 seconds later, the J-2 engines on the S-II stage receive their start command.
0000244|AFJ||The interstage ullage rockets were eventually deleted from the later Saturn Vs. Ullage is a brewer's term for the space in a barrel taken up by air rather than liquor. The rocket people modify its use to mean the establishment of a similar non-liquid space at the opposite end of a tank from the outlet so that only liquid leaves the tank with a degree of pressure to help it flow to the engine. This is usually achieved by firing small rockets to settle the tank's contents to one end.
0000246|AFJ||The S-II stage carries five uprated J-2 engines which burn LH<sub>2</sub> and LOX to produce a total of 5,141 kN (1,155,859 pounds) thrust. The engine design allows for restarting in flight but this feature is only implemented in the single engine used in the S-IVB.
0000246|AFJ||The thrust chamber and bell of each engine is fabricated from stainless steel tubes brazed together to make a single unit. Supercold LH<sub>2</sub> is pumped through these tubes to cool the thrust chamber and simultaneously turn the fuel to a gas. The engine carries two separate turbopumps, both powered in turn by the exhaust from a gas generator which burns the stage's main propellants. The hot gas exhaust is fed from the gas generator, first to the fuel turbopump, then to the LOX turbopump before being routed to a heat exchanger and finally into the engine bell where its partial combustion is completed. The fuel and LOX outputs of both turbopumps are fed, via main control valves, to the thrust chamber injector via the LOX dome. Unlike the copper-faced injector of the F-1, the J-2 injector face is fabricated from layers of stainless steel mesh sintered into a single porous unit. A solid LOX injector behind this has 614 posts which pass LOX through holes in the injector face and into the combustion chamber. Each post has a concentric fuel orifice around it and these orifices are attached to the porous injector. The gaseous fuel passes around each LOX tube, atomising the liquid as it emerges. Delivery is arranged to ensure that about 5 percent of the gaseous hydrogen seeps through the injector face to keep it cool, the rest passing through the annular orifices.
0000246|AFJ||Valves are provided to bleed propellant through the supply system well before ignition to chill all components to their operating temperatures otherwise gas would be formed which would interfere with the engine's use of propellant as a lubricant in the turbopump bearings. The ASI (Augmented Spark Igniter) is mounted in the centre of the injector face and fed with propellant. Energised by sparks at the start of a burn. it provides a flame to initiate and maintain full combustion.
